s_no,question,answer,max_marks
1,What is the law of conservation of mass?,The law of conservation of mass states that mass can neither be created nor destroyed in a chemical reaction.,2
2,What is a Database.,It’s a Dustbin,10
3,Explain the process of photosynthesis.,Photosynthesis is the process by which green plants and some other organisms use sunlight to synthesize foods from carbon dioxide and water. It involves the green pigment chlorophyll and generates oxygen as a by-product.,2
4,What is the role of DNA in heredity?,DNA responsible for the transmission of hereditary characteristics from parents to offspring.,5
5,Describe the structure of a neuron.,"A neuron consists of a cell body with a nucleus and cytoplasm, from which long extensions called dendrites and axons project out to transmit signals.",2
